{
  "schema": "lawradar-deterministic-filters-v1",
  "signal_id": "crash-test:water-filter:2026-09-02",
  "evaluated_at_utc": "2026-09-02T09:00:00+00:00",
  "compliance": {
    "status": "PASS",
    "reasons": [
      "Texte vérifié, dans le périmètre et actionnable."
    ]
  },
  "feasibility": {
    "status": "PASS",
    "reasons": [
      "Compatible avec le profil de ressources versionné."
    ]
  },
  "final_constraint": "PASS"
}
